{
  "case_id": "OP-YYYY-XXXX",
  "operation_type": "institutions",
  "target_name": "",
  "target_url": "",
  "scope_type": "business-facing-public-analysis",
  "analysis_goal": "",
  "restrictions": [
    "no personal dossier",
    "no intrusive scanning",
    "public sources only"
  ],
  "analyst_notes": "",
  "source_seed": []
}
